52;Памятное место медикам, погибшим в годы Великой Отечественной войны;Военные памятники;Памятник расположен за центральным входом в городскую больницу №1 имени Н.А. Семашко. Обелиск был воздвигнут в 90-е годы прошлого века. Спус;;на территории БСМП-1 (ЦГБ);47.234553;39.71234;;
53;Памятник рабочим завода «Красный Дон», погибшим в годы Великой Отечественной войны;Военные памятники;В г. Ростове-на-Дону напротив проходной судоремонтного завода «Красный Дон» установлен памятник морякам-краснофлотцам и рабочим судоремо;;ул. Береговая, 67, у здания заводоуправления судоремонтного завода ЗАО  «Красный Дон»;47.218984;39.735131;;
54;Памятное место студентам и сотрудникам РИСХМ, погибшим в годы Великой Отечественной войны;Военные памятники;В годы Великой Отечественной войны в ноябре 1941 года часть коллектива института была прикомандирована к заводу «Ростсельмаш» и вместе с ни;;на территории ДГТУ;47.239232;39.710426;;
55;Памятное место «Памяти Героев-ростсельмашевцев, погибших в годы Великой Отечественной войны»;Военные памятники;Великая Отечественная война не обошла стороной Ростсельмаш. Уже в первые дни войны сотни сотрудников записались добровольцами. 10 июля 1941;;на территории ОАО «Ростсельмаш»;47.254137;39.762722;;
56;Памятник «Водникам Дона всех поколений, отдавшим свои жизни за свободу и независимость Российского Отечества»;Военные памятники;В 2018 г. в Ростове-на-Дону состоялась церемония открытия памятника, посвященного всем морякам, погибшим в борьбе за освобождение города, в т;Ассоциация «Водный транспорт Дона»;Сквер на ул. Седова;47.218188;39.725406;;
57;Памятное место «Вечная память героям 1941-1945 гг.»;Военные памятники;Памятное место олицетворяет ушедшие в прошлое события, связанные с освобождением Ростова-на-Дону в 1943 г. При отступлении из города оккупан;;на территории ЗАО «Эмпилс»;47.253396;39.597195;;
58;Памятник на могиле лейтенанта Н. Голопузова;Военные памятники;Незаметное солдатское надгробие – металлическая, уже серьезно тронутая ржавчиной пирамида со звездой на верхушке – несколько десятилет;;ул. Пирогова / ул. Краснокурсантская;47.264991;39.709351;;
59;Памятный знак на месте расстрела 90 мирных жителей;Военные памятники;С трагическими событиями Великой Отечественной связан еще один дом на Советской — 29 ноября 1941 года у здания на углу 1-й Советской и Верхне-;;ул. Советская, 2;47.228371;39.750307;;
60;Братская могила лётчиков, погибших в годы Великой Отечественной войны;Военные памятники;События Великой Отечественной войны навсегда запечатлелись в нашей истории, памяти, а также в наших сердцах. Военные летчики В.О. Бахтин, А.;;ул. Ленина, 215, на территории санатория «Сосновая дача»;47.247932;39.74517;;
62;Братская могила советских воинов;Военные памятники;На месте братского захоронения установлен небольшой памятник.;;ул. Тракторная, 48 Д, санаторий «Ростовский»;47.265246;39.693898;;
63;Братское захоронение Великой Отечественной войны;Военные памятники;Братское захоронение расположено в небольшом скверике на ул. Солидарности.  Над ним сооружен двухфигурный каменный монумент. К северу от п;Архитектор Ю. Чижиков;ул. Солидарности;47.229444;39.811614;;
64;Братское захоронение советских  воинов;Военные памятники;Между улицами Волоколамской и Тоннельной в годы войны находился концлагерь, носивший название Дулаг 102 Б. (Б - предположительно). Сейчас это;;ул. Волоколамская, 12 ;47.256048;39.683606;;
65;Греческая церковь в честь Благовещения Пресвятой Пресвятой Богородицы;Храмы религиозных конфессий;Греческая церковь в честь Благовещения Пресвятой Богородицы - греческий православный храм. В 2003 г. для строительства храма был выделен зем;Архитектор Г. А. Шевченко;пр. Кировский, 58;47.228785;39.72776;;
66;Буддийский центр Алмазного Пути Традиции Карма Кагью;Храмы религиозных конфессий;"Находится в г. Ростове-на-Дону. В настоящее время не работает.
Карма Кагью – одна из четырех основных школ тибетского буддизма, ориентирова";;пр. Крыловской, 10/13;47.219958;39.727904;;
67;Кафедральный собор во имя Рождества Пресвятой Богородицы;Храмы религиозных конфессий;Кафедральный собор Ростовской и Новочеркасской епархии был построен в 1854–1860 гг. по проекту архитектора Константина Тона и внешне схож с д;Архитектор А.С. Кутепов;ул. Станиславского, 58;47.217194;39.711976;;
68;Памятник атаману М.И.  Платову;Памятники выдающимся историческим деятелям;В Ростове-на-Дону при пересечении улицы Большой Садовой  с переулком Университетским 24 августа 2015 года торжественно был открыт памятник а;Скульптор К.Р. Чернявский и архитектор А.С. Шапин (при участии С.В. Лебедевой);пр. Университетский / ул. Б. Садовая;47.224808;39.727979;;
69;Памятник  А.М. Байкову;Памятники выдающимся историческим деятелям;"Памятник был открыт 14 сентября 2013 г. между центральным входом в парк им. Горького и городской Администрацией. 
Автором скульптуры является";Скульптор А.А. Скнарин;ул. Большая Садовая;47.221169;39.711549;;
70;Памятник епископу РПЦ и митрополиту Ростовской и Ярославской епархии Димитрию Ростовскому;Памятники выдающимся историческим деятелям;Памятник Димитрию Ростовскому был установлен перед Собором Рождества Пресвятой Богородицы – кафедральным собором Ростовской и Новочерк;Скульптор Владимир Беляков. Архитектор Н.Ф. Гмыря;ул. Московская;47.217817;39.711824;;
71;Памятник императрице Елизавете Петровне;Памятники выдающимся историческим деятелям;Монумент находится в Покровском сквере города Ростов-на-Дону. Посвящён российской императрице и основательнице города. Располагается в П;Скульптор С.Н. Олешня;Покровский сквер;47.225627;39.732255;;
72;Памятник Карлу Марксу;Памятники выдающимся историческим деятелям;"Монумент установлен в 1959 году на месте памятника Марксу, уничтоженному во время войны.
Первоначально памятник Карлу Марксу был торжествен";Скульптор М.С. Альтшулер и архитектор  М.А. Минкус;пл. Карла Маркса;47.230613;39.762662;;
73;Памятник С.М. Кирову;Памятники выдающимся историческим деятелям;Памятник был открыт в 1939 г. и первоначально располагался в Покровском (Кировском) сквере. Сергей Миронович Киров был в Ростове весной 1918 г.;Скульптор З.М. Виленский  и архитектор  В.В. Баринов;пр. Кировский / ул. Пушкинская;47.228377;39.728879;;
74;Памятник Ленину на Большой Садовой улице (Ростов-на-Дону);Памятники выдающимся историческим деятелям;Один из первых в СССР памятников российскому и советскому политическому и государственному деятелю, революционеру, одному из организатор;Скульптор Г.В. Нерода и архитектор П.Н. Андреев;Парк им. М. Горького / ул. Б. Садовая;47.220962;39.709984;;
75;Памятник Степану Разину и его верной дружине;Памятники выдающимся историческим деятелям;Памятник Степану Разину – один из монументов в городе Ростов-на-Дону. Посвящён Степану Тимофеевичу Разину, предводителю крестьянского во;Народный художник СССР С.Т. Коненков и архитектор Л. М. Лобан;ул. Береговая, 51;47.217739;39.728312;;
76;Памятник генералиссимусу А.В.Суворову;Памятники выдающимся историческим деятелям;Памятник Суворову – памятник русскому полководцу, генералиссимусу Александру Васильевичу Суворову в городе Ростов-на-Дону. Установлен в;Скульптор А.А. Скнарин;пер. Университетский / ул. Суворова;47.225611;39.727702;;
77;Старо-Покровский храм;Храмы религиозных конфессий;Храм во имя Покрова Пресвятой Богородицы — один из старейших в Ростове-на-Дону. В 1762 г., после упразднения крепости Святой Анны, расположен;Архитектор Г.А. Шевченко;ул. Большая Садовая, 113 Б;47.225764;39.732217;;
78;Ростовская соборная мечеть;Храмы религиозных конфессий;"Ростовская соборная мечеть — единственная действующая мечеть в Ростове-на-Дону. 
Рядом с двухэтажным зданием мечети возвышается 27-метров";Архитектор Б.К. Ногарбеков;ул. Фурмановская, 131;47.272385;39.724171;;
79;Ростовская солдатская синагога;Храмы религиозных конфессий;Солдатская синагога — единственная действующая синагога в Ростове-на-Дону. В 1862 г. отставные солдаты-евреи создали в Ростове-на-Дону еврей;Архитекторы В.И. Якунин и Я.Г. Гевирц;ул. Тургеневская, 66/18;47.217549;39.718004;;
80;Основателям крепости Дмитрия Ростовского;Памятники выдающимся историческим деятелям;Памятник в центре Ростова-на-Дону в честь основателей города: руководителя строительства Ростовской крепости Александра Ригельмана, перв;Скульптор С.Н. Олешня архитектор В. Фоменко;пер. Крепостной / ул. Б. Садовая;47.226371;39.736594;;
81;Старообрядческий Покровский собор;Храмы религиозных конфессий;Кафедральный собор Донской и Кавказской епархии Русской православной старообрядческой церкви. Построен в 1913 г. по проекту архитектора В.;Архитектор В.А. Покровский;ул. Ульяновская, 37;47.216576;39.717097;;
82;Храм Преподобного Серафима Саровского;Храмы религиозных конфессий;Церковь Серафима Саровского — православный храм в Ростове-на-Дону, принадлежит к Ростовской и Новочеркасской епархии Московского патриа;Архитектор Б.А. Райченков;ул. Портовая, 72А;47.208857;39.689806;;
83;Церковь Сурб Хач;Храмы религиозных конфессий;Церковь Сурб Хач (арм. Церковь Святого Креста) — армянская церковь в Ростове-на-Дону. Одна из сохранившихся построек ранее существовавшего;Архитектор И. Старов;ул. Баграмяна, 1;47.290522;39.722038;;
84;Церковь Тайной Вечери;Храмы религиозных конфессий;Церковь Тайной Вечери — католическая церковь в Ростове-на-Дону. Административно принадлежит к Ростовскому деканату южнороссийской Епарх;;пер. Ставропольский, 1;47.258933;39.703765;;
85;«Шолохов-центр» музея-заповедника М.А. Шолохова;Музеи;Накануне 110-летия Михаила Александровича Шолохова, губернатор Василий Голубев, замминистра культуры России Елена Миловзорова и внук писа;Архитектор Н.М. Соколов;ул. Большая Садовая, 125/69;47.226282;39.736204;;
86;Культурно-выставочный центр «Донская казачья гвардия»;Музеи;«Донская казачья гвардия» — подразделение Донского государственного технического университета (ДГТУ), крупнейшего ВУЗа на Юге России. В;Архитектор Н.М. Соколов;ул. Социалистическая, 162/32;47.22373;39.732359;;
87;Музей истории органов правопорядка Дона;Музеи;Все вехи истории правопорядка отображены в музее донского полицейского главка, который уже 35 лет возглавляет заслуженный работник культу;;ул. Большая Садовая, 29;47.219437;39.703222;;
88;Музей русско-армянской дружбы;Музеи;Музей русско-армянской дружбы  — музей в городе Ростов-на-Дону, располагался в армянской церкви Сурб Хач. Музей открыт 14 ноября 1972 г. Церков;;пл. Свободы, 14/2;47.229134;39.765121;;
89;Музей СКЖД;Музеи;Музей Северо-Кавказской железной дороги — музейный комплекс, состоящий из двух площадок: помещение музея во Дворце культуры железнодорож;Архитектор Н. Вальтер;пер. Казачий, 44Б;47.190484;39.636221;;
90;Музей современного изобразительного искусства;Музеи;Музей современного изобразительного искусства открыт 24 февраля 2005 г. Инициаторами открытия первого частного музея современного искусств;Архитектор Е.М. Гулин;ул. Шаумяна, 51;47.22067;39.712884;;
91;Музей трудовой славы Ростсельмаша;Музеи;В музее «Ростсельмаш» представлена продукция компании «Ростсельмаш», которая выпускалась на предприятии, начиная с 1929 г.;Архитектор А. Мулик;пр. Сельмаш, 3;47.24969;39.763342;;
92;Памятник Александру Ханжонкову;Памятники выдающимся деятелям литературы и искусства;Памятник российскому кинематографисту  Александру Ханжонкову на Будённовском проспекте в Ростове-на-Дону, в сквере напротив гимназии (ны;Скульптор С.Н. Олешня;пр. Будённовский, 59;47.227;39.704173;;
93;Памятник А. П. Чехову;Памятники выдающимся деятелям литературы и искусства;Бронзовый монумент, который был установлен в честь 150-летия со дня рождения писателя Антона Павловича Чехова.  В Ростове-на-Дону памятник р;Скульптор  А. Скнарин;пр. Чехова / ул. Пушкинская;47.226896;39.722846;;
94;Памятник М.А. Шолохову на набережной Ростова-на-Дону;Памятники выдающимся деятелям литературы и искусства;В мае 2000 года на набережной реки Дон (Ростов-на-Дону) был установлен памятник М.A. Шолохову. До 2000 года такого монумента известному писателю;Скульптор Н.В. Можаев;ул. Береговая;47.21351;39.712406;;
95;Ростовский музей космонавтики;Музеи;Ростовский музей космонавтики ? одно из подразделений научно-образовательного комплекса «Вертикаль». Музей был торжественно открыт в гор;;пр. Стачки, 231/2;47.210773;39.619234;;
96;Ростовский областной музей изобразительных искусств;Музеи;Ростовский областной музей изобразительных искусств как самостоятельное учреждение существует с 1938 г. Собрание музея включает около 6000 п; Архитектор Н.А. Дорошенко;ул. Пушкинская, 115;47.225762;39.715794;;
97;Ростовский областной музей краеведения;Музеи;Ростовский областной музей краеведения – один из крупнейших на юге России. Его коллекции насчитывают около 390 тыс. предметов. Ежегодно бол;Архитектор Е.В. Григор;ул. Б. Садовая, 79;47.223712;39.722244;;
98;Гостиница Московская;Памятники архитектуры;Гостиница «Московская» (бывшая «Большая Московская») — гостиница в Ростове-на-Дону, расположенная на Большой Садовой улице (дом 62). е. Во вр;Архитекторы А.Н. Померанцев и Н.Н. Дурбах;ул. Б. Садовая, 62;47.220842;39.712264;;
99;Дом братьев Мартын;Памятники архитектуры;Двухэтажный дом из красного кирпича был сооружён в 1893 году по проекту ростовского архитектора Николая Матвеевича Соколова. Архитектурно-;Архитектор Н.М. Соколов;пер. Крепостной, 69/125;47.226282;39.736204;;
100;Дом И.Н. Зворыкина (Дом Заславской);Памятники архитектуры;Здание на перекрёстке Пушкинской улицы и переулка Семашко. Построено в 1914 г. по проекту архитектора Василия Попова. До революции в доме жил;Архитектор В. Попов;ул. Пушкинская, 89/57;47.22477;39.71141;;
101;Дом купца Кистова, корпус РГУ с 1935 г.;Памятники архитектуры;Главный корпус Южного федерального университета (Доходный дом купца Кистова) — здание в Ростове-на-Дону, построенное по проекту архитекто;Архитектор Г.Н. Васильев;ул. Большая Садовая, 105/42;47.224765;39.728595;;
102;Дом Маргариты Черновой;Памятники архитектуры;Дом Маргариты Черновой — здание в Ростове-на-Дону. Особняк построен в 1899 г. по проекту архитектора  Н А. Дорошенко, он принадлежал М.Н. Черно;Архитектор Н.А. Дорошенко;ул. Большая Садовая, 27/47;47.219257;39.702284;;
103;Здание городской думы Ростова-на-Дону;Памятники архитектуры;Здание городской думы (Городской дом) — здание в Ростове-на-Дону, одно из главных архитектурных достопримечательностей города. Изначально;Архитектор А. Никанорович и А.Н. Померанцев;ул. Большая Садовая, 47;47.221705;39.712156;;
104;Здание Государственного цирка;Памятники архитектуры;Первый цирк в Ростове-на-Дону появился ещё в конце 19 в. За это время он несколько раз менял своё «место жительства». Но после Великой Отечес;Архитектор Г. Петров и В. Барилин;пр. Буденновский, 45/72;47.22441;39.705041;;
105;Здание Ростовского областного музея изобразительных искусств;Памятники архитектуры;Это здание известно также как «особняк А.Домбровского». За этим «двойным» названием памятника, скрывается его необычная история. Проект д;Архитектор Н.А. Дорошенко;ул. Пушкинская, 117;47.225762;39.715794;;
